{
  "latest": {
    "size": 115201908,
    "manifestVersion": "4.0.4",
    "sha256": "87a3437ea3c78d754896c2adfcd94efe4082fda37c2badd8e1dff56362aad4b2",
    "version": "4.0.4",
    "kind": "full-package",
    "packageName": "OSMINOG-Preview-4.0.4-x64.exe",
    "minDevHubVersion": "0.0.0",
    "notes": "OSMINOG Windows Preview 4.0.4\n\nИсправлен запуск исполнителя из видимых вкладок ИИ справа. Скрытые служебные сессии исключены. Доступность самого сайта DeepSeek этим обновлением не гарантируется.\n\nUnsigned preview. Source 84a71d8f8d7e86f6fe09cdc479fa9290da496a73. Windows tests cover installed paths, native panes, fixture provider replies, native input and canvas drag. Live provider accounts and Figma are not certified by fixture tests. SHA-256: 87a3437ea3c78d754896c2adfcd94efe4082fda37c2badd8e1dff56362aad4b2",
    "publishedAt": "2026-10-15T03:55:36Z",
    "packageUrl": "https://github.com/jeep-jim/OSMINOG-Releases/releases/download/windows-v4.0.4/OSMINOG-Preview-4.0.4-x64.exe",
    "sourceCommit": "84a71d8f8d7e86f6fe09cdc479fa9290da496a73"
  },
  "generatedAt": "2026-10-15T03:55:39.1468922Z",
  "status": "active",
  "schema": "osminog-update-feed/v2",
  "product": "OSMINOG",
  "channel": "dev",
  "platform": "windows"
}
